### ISSUE TITLE
AuthPriv security_level return Incoming packet is not authentic

### ISSUE THREAD

**Issue by kuberxy** [prometheus/snmp_exporter#543]
### Host operating system: output of `uname -a`
Linux cylocal005 4.15.0-106-generic #107-Ubuntu SMP Thu Jun 4 11:27:52 UTC 2020 x86_64 x86_64 x86_64 GNU/Linux

### snmp_exporter version: output of `snmp_exporter -version`

snmp_exporter-0.18.0.linux-amd64

### What device/snmpwalk OID are you using?
HUAWEI AR

```yml
if_mib:
  version: 3
  auth:
    community: xxx
    security_level: xx
    username: xxx
    auth_protocol: SHA
    password: xxx
    priv_password: xxx
    priv_protocol: "AES"


### What did you do that produced an error?
$ ./snmp_exporter 
level=info ts=2020-06-28T03:21:20.073Z caller=main.go:149 msg="Starting snmp_exporter" version="(version=0.18.0, branch=HEAD, revision=9a2ff257dd2e8cdb2a4c88b18df668e2008c2cd6)"
level=info ts=2020-06-28T03:21:20.073Z caller=main.go:150 build_context="(go=go1.14.3, user=root@84ec61d89273, date=20200526-08:26:47)"
level=info ts=2020-06-28T03:21:20.155Z caller=main.go:243 msg="Listening on address" address=:9116
level=info ts=2020-06-28T03:21:20.242Z caller=collector.go:224 module=if_mib target=192.168.3.1 msg="Error scraping target" err="error getting target 192.168.3.1: Incoming packet is not authentic, discarding"

$ snmpwalk -v3 -l authPriv -u test -a SHA -A "xxx" -x AES -X "xxx" 192.168.x.x 1.3.6.1.2.1.47.1.1.1.1.7
iso.3.6.1.2.1.47.1.1.1.1.7.3 = STRING: "AR2220E-S"
iso.3.6.1.2.1.47.1.1.1.1.7.5 = STRING: "Board slot 0"
iso.3.6.1.2.1.47.1.1.1.1.7.9 = STRING: "SRU Board 0"
iso.3.6.1.2.1.47.1.1.1.1.7.14 = STRING: "GigabitEthernet0/0/0"
iso.3.6.1.2.1.47.1.1.1.1.7.78 = STRING: "GigabitEthernet0/0/1"
iso.3.6.1.2.1.47.1.1.1.1.7.142 = STRING: "GigabitEthernet0/0/2"
iso.3.6.1.2.1.47.1.1.1.1.7.206 = STRING: "GigabitEthernet0/0/3"
iso.3.6.1.2.1.47.1.1.1.1.7.270 = STRING: "Cellular0/0/0"
iso.3.6.1.2.1.47.1.1.1.1.7.334 = STRING: "Cellular0/0/1"
iso.3.6.1.2.1.47.1.1.1.1.7.16396 = STRING: "Card slot 0/1"
iso.3.6.1.2.1.47.1.1.1.1.7.16397 = STRING: "FAN Card 0/1"
iso.3.6.1.2.1.47.1.1.1.1.7.262149 = STRING: "Board slot 1"
iso.3.6.1.2.1.47.1.1.1.1.7.524293 = STRING: "Board slot 2"
iso.3.6.1.2.1.47.1.1.1.1.7.786437 = STRING: "Board slot 3"
iso.3.6.1.2.1.47.1.1.1.1.7.1048581 = STRING: "Board slot 4"
iso.3.6.1.2.1.47.1.1.1.1.7.1310725 = STRING: "Board slot 5"
iso.3.6.1.2.1.47.1.1.1.1.7.1572869 = STRING: "Board slot 6"

**Comment by brian-brazil** [comment]
Does an snmpbulkwalk return the same? What does tcpdump say?

**Comment by nugored** [comment]
Hey! I have the same problem! I tcpdumped snmpwalk and snmp_exporter scraping simple sysDescr oid.

Here is first three packets of snmpwalk:
```
17:05:29.199448 IP snmp-exporter.test.44104 > switch.test:  F=r U="" E= C="" GetRequest(14) 
E..\..@.@.	S..u....f.H...H..0>...0.....	..............0...............0.........~.o.......0.

17:05:29.204652 IP switch.test > snmp-exporter.test.44104:  F= U="" E=_80_00_63_a2_03_b8_af_67_5b_46_c6 C="" Report(30)  S:snmpUsmMIB.usmMIBObjects.usmStats.usmStatsUnknownEngineIDs.0=122587
E.........!....f..u....H.|3.0r...0.....	............*0(....c....g[F...
.....*..................0/....c....g[F..............0.0..
+.........A....

17:05:29.204781 IP snmp-exporter.test.44104 > switch.test:  F=apr U="user" [!scoped PDU]1b_db_5d_f7_01_3d_30_b7_2b_9d_28_3a_d9_08_8c_36_ff_88_e1_a3_e9_2a_46_42_a7_02_4b_89_3c_ef_56_83_82_00_9a_30_55_a5_68_ca_af_51_de_d9_b1_12_ca_e8
E.....@.@.	...u....f.H.....E0.....0.....	.............907....c....g[F...
.....*..user..x...(.*..K..........}W.0..]..=0.+.(:...6.....*FB..K.<.V....0U.h..Q......
```

And here is snmp_exporter first three packets dump:
```
17:05:50.988761 IP snmp-exporter.test.56367 > switch.test.snmp:  F=r U="" E= C="" GetRequest(14)
E..\I.@.?.[...u....f./...H..0>...0...8.'..............0...............0.........{.{.......0.

17:05:51.009343 IP switch.test.snmp > snmp-exporter.test.56367:  F= U="" E=_80_00_63_a2_03_b8_af_67_5b_46_c6 C="" Report(30)  S:snmpUsmMIB.usmMIBObjects.usmStats.usmStatsUnknownEngineIDs.0=122589
E.........!....f..u..../.|..0r...0...8.'............*0(....c....g[F...
.....@..................0/....c....g[F..............0.0..
+.........A....

17:05:51.009553 IP snmp-exporter.test.56367 > switch.test.snmp:  F=r U="" E= C="" GetRequest(14)
E..\I.@.?.[...u....f./...H..0>...0...8.'..............0...............0.........{.{.......0.
```

Check out 3rd packet. Snmpwalk sends `user` option and some other ones. But snmp_exporter doesn't.
Hope to help investigation. Give a feedback please.

**Comment by brian-brazil** [comment]
It looks like it is the 2nd packet there which is not authentic, and the 3rd packet is a retry. I'm not too familiar with the v3 auth protocol, but are you sure your passwords are correct?

**Comment by nugored** [comment]
I don't see any difference for 2nd packets. It looks like structure of packets is equal. 3rd ones is a try to ask actual info(OIDS) with creds. For `snmpwalk` it went right and it sent username, but `snmp_exporter` didn't.

**Comment by brian-brazil** [comment]
It's not a question of difference (and it's a human-readable munged representation, not the hex so you can't determine if it's the same) it's a question of if it is authentic.

**Comment by nugored** [comment]
I'm sure my template and my credentials are right. I scrape and get "authentic error" with the same template but different targets.
1 template
1 login
1 password
One target scrape is ok
Second target got error woth "non authentic packet"
