### ISSUE TITLE
returning 0 metric for some switch ports but not others

### ISSUE THREAD

**Issue by wtip** [prometheus/snmp_exporter#127]
I've discovered that the SNMP exporter is not returning metrics for some of the ports on my switch.

```
# HELP ifHighSpeed 
# TYPE ifHighSpeed untyped
ifHighSpeed{ifName="1"} 0
ifHighSpeed{ifName="2"} 0
ifHighSpeed{ifName="ch1"} 1000
ifHighSpeed{ifName="ch2"} 0
ifHighSpeed{ifName="ch3"} 0
ifHighSpeed{ifName="ch4"} 0
ifHighSpeed{ifName="ch5"} 0
ifHighSpeed{ifName="ch6"} 0
ifHighSpeed{ifName="ch7"} 0
ifHighSpeed{ifName="ch8"} 0
ifHighSpeed{ifName="g1"} 0
ifHighSpeed{ifName="g10"} 0
ifHighSpeed{ifName="g11"} 0
ifHighSpeed{ifName="g12"} 0
ifHighSpeed{ifName="g13"} 0
ifHighSpeed{ifName="g14"} 0
ifHighSpeed{ifName="g15"} 0
ifHighSpeed{ifName="g16"} 0
ifHighSpeed{ifName="g17"} 1000
ifHighSpeed{ifName="g18"} 1000
ifHighSpeed{ifName="g19"} 1000
ifHighSpeed{ifName="g2"} 0
ifHighSpeed{ifName="g20"} 1000
ifHighSpeed{ifName="g21"} 1000
ifHighSpeed{ifName="g22"} 1000
ifHighSpeed{ifName="g23"} 1000
ifHighSpeed{ifName="g24"} 1000
ifHighSpeed{ifName="g3"} 0
ifHighSpeed{ifName="g4"} 0
ifHighSpeed{ifName="g5"} 0
ifHighSpeed{ifName="g6"} 0
ifHighSpeed{ifName="g7"} 0
ifHighSpeed{ifName="g8"} 0
ifHighSpeed{ifName="g9"} 0
```
```
# HELP snmp_scrape_duration_seconds Total SNMP time scrape took (walk and processing).
# TYPE snmp_scrape_duration_seconds gauge
snmp_scrape_duration_seconds 7.754726645
# HELP snmp_scrape_pdus_returned PDUs returned from walk.
# TYPE snmp_scrape_pdus_returned gauge
snmp_scrape_pdus_returned 1145
# HELP snmp_scrape_walk_duration_seconds Time SNMP walk/bulkwalk took.
# TYPE snmp_scrape_walk_duration_seconds gauge
snmp_scrape_walk_duration_seconds 7.741732837
# HELP sysUpTime 
# TYPE sysUpTime untyped
sysUpTime 1.5750209e+07
```
However when I do an snmpwalk on these OIDs the proper numbers are reported.
```
root@test:~# snmpwalk -v 2c -c public 10.255.255.43 1.3.6.1.2.1.31.1.1.1.15
iso.3.6.1.2.1.31.1.1.1.15.1 = Gauge32: 1000
iso.3.6.1.2.1.31.1.1.1.15.2 = Gauge32: 1000
iso.3.6.1.2.1.31.1.1.1.15.3 = Gauge32: 1000
iso.3.6.1.2.1.31.1.1.1.15.4 = Gauge32: 1000
iso.3.6.1.2.1.31.1.1.1.15.5 = Gauge32: 1000
iso.3.6.1.2.1.31.1.1.1.15.6 = Gauge32: 1000
iso.3.6.1.2.1.31.1.1.1.15.7 = Gauge32: 1000
iso.3.6.1.2.1.31.1.1.1.15.8 = Gauge32: 1000
iso.3.6.1.2.1.31.1.1.1.15.9 = Gauge32: 1000
iso.3.6.1.2.1.31.1.1.1.15.10 = Gauge32: 1000
iso.3.6.1.2.1.31.1.1.1.15.11 = Gauge32: 1000
iso.3.6.1.2.1.31.1.1.1.15.12 = Gauge32: 1000
iso.3.6.1.2.1.31.1.1.1.15.13 = Gauge32: 1000
iso.3.6.1.2.1.31.1.1.1.15.14 = Gauge32: 1000
iso.3.6.1.2.1.31.1.1.1.15.15 = Gauge32: 1000
iso.3.6.1.2.1.31.1.1.1.15.16 = Gauge32: 1000
iso.3.6.1.2.1.31.1.1.1.15.17 = Gauge32: 1000
iso.3.6.1.2.1.31.1.1.1.15.18 = Gauge32: 1000
iso.3.6.1.2.1.31.1.1.1.15.19 = Gauge32: 1000
iso.3.6.1.2.1.31.1.1.1.15.20 = Gauge32: 1000
iso.3.6.1.2.1.31.1.1.1.15.21 = Gauge32: 1000
iso.3.6.1.2.1.31.1.1.1.15.22 = Gauge32: 1000
iso.3.6.1.2.1.31.1.1.1.15.23 = Gauge32: 1000
iso.3.6.1.2.1.31.1.1.1.15.24 = Gauge32: 1000
iso.3.6.1.2.1.31.1.1.1.15.25 = Gauge32: 1000
iso.3.6.1.2.1.31.1.1.1.15.26 = Gauge32: 0
iso.3.6.1.2.1.31.1.1.1.15.27 = Gauge32: 0
iso.3.6.1.2.1.31.1.1.1.15.28 = Gauge32: 0
iso.3.6.1.2.1.31.1.1.1.15.29 = Gauge32: 0
iso.3.6.1.2.1.31.1.1.1.15.30 = Gauge32: 0
iso.3.6.1.2.1.31.1.1.1.15.31 = Gauge32: 0
iso.3.6.1.2.1.31.1.1.1.15.32 = Gauge32: 0
iso.3.6.1.2.1.31.1.1.1.15.100000 = Gauge32: 0
iso.3.6.1.2.1.31.1.1.1.15.100001 = Gauge32: 0
root@test:~# snmpwalk -v 2c -c public 10.255.255.43 1.3.6.1.2.1.31.1.1.1.1
iso.3.6.1.2.1.31.1.1.1.1.1 = STRING: "g1"
iso.3.6.1.2.1.31.1.1.1.1.2 = STRING: "g2"
iso.3.6.1.2.1.31.1.1.1.1.3 = STRING: "g3"
iso.3.6.1.2.1.31.1.1.1.1.4 = STRING: "g4"
iso.3.6.1.2.1.31.1.1.1.1.5 = STRING: "g5"
iso.3.6.1.2.1.31.1.1.1.1.6 = STRING: "g6"
iso.3.6.1.2.1.31.1.1.1.1.7 = STRING: "g7"
iso.3.6.1.2.1.31.1.1.1.1.8 = STRING: "g8"
iso.3.6.1.2.1.31.1.1.1.1.9 = STRING: "g9"
iso.3.6.1.2.1.31.1.1.1.1.10 = STRING: "g10"
iso.3.6.1.2.1.31.1.1.1.1.11 = STRING: "g11"
iso.3.6.1.2.1.31.1.1.1.1.12 = STRING: "g12"
iso.3.6.1.2.1.31.1.1.1.1.13 = STRING: "g13"
iso.3.6.1.2.1.31.1.1.1.1.14 = STRING: "g14"
iso.3.6.1.2.1.31.1.1.1.1.15 = STRING: "g15"
iso.3.6.1.2.1.31.1.1.1.1.16 = STRING: "g16"
iso.3.6.1.2.1.31.1.1.1.1.17 = STRING: "g17"
iso.3.6.1.2.1.31.1.1.1.1.18 = STRING: "g18"
iso.3.6.1.2.1.31.1.1.1.1.19 = STRING: "g19"
iso.3.6.1.2.1.31.1.1.1.1.20 = STRING: "g20"
iso.3.6.1.2.1.31.1.1.1.1.21 = STRING: "g21"
iso.3.6.1.2.1.31.1.1.1.1.22 = STRING: "g22"
iso.3.6.1.2.1.31.1.1.1.1.23 = STRING: "g23"
iso.3.6.1.2.1.31.1.1.1.1.24 = STRING: "g24"
iso.3.6.1.2.1.31.1.1.1.1.25 = STRING: "ch1"
iso.3.6.1.2.1.31.1.1.1.1.26 = STRING: "ch2"
iso.3.6.1.2.1.31.1.1.1.1.27 = STRING: "ch3"
iso.3.6.1.2.1.31.1.1.1.1.28 = STRING: "ch4"
iso.3.6.1.2.1.31.1.1.1.1.29 = STRING: "ch5"
iso.3.6.1.2.1.31.1.1.1.1.30 = STRING: "ch6"
iso.3.6.1.2.1.31.1.1.1.1.31 = STRING: "ch7"
iso.3.6.1.2.1.31.1.1.1.1.32 = STRING: "ch8"
iso.3.6.1.2.1.31.1.1.1.1.100000 = STRING: "1"
iso.3.6.1.2.1.31.1.1.1.1.100001 = STRING: "2"
```
This happens for more than just the ifHighSpeed metric. I just figured I didn't need to post the complete output. Any ideas what could be happening?

**Comment by SuperQ** [comment]
I copied all 3 of the samples into different files, wc -l says 34 metrics in all cases.  Are you sure there's something missing?

**Comment by SuperQ** [comment]
Oh, now I see, you're saying that the metric values are 0 in some cases.  That's very strange.

What version of snmp_exporter are you using?

**Comment by SuperQ** [comment]
Next question, if you specify the `default_ifindex` module, instead of `default_ifname`, do you still see the same problem?

**Comment by wtip** [comment]
I'm running snmp_exporter-0.1.0.linux-amd64.
I'll have to try that tomorrow

**Comment by brian-brazil** [comment]
That shouldn't make a difference, though default_ifindex would be a bit easier to read for the sake of debugging this.

This is likely a buggy switch that can't handle the max repetitions we use. Try `-Cr25` on the snmpbulkwalk to verify.

**Comment by wtip** [comment]
As another data point it's a Dell powerconnect 5324

**Comment by wtip** [comment]
`snmpbulkwalk -v 2c -Cr25 -c public 10.255.255.43 1.3.6.1.2.1.31.1.1.1.15`
This returns the metrics just fine. Was this the test you had in mind?

**Comment by brian-brazil** [comment]
Yes, that's the query the snmp exporter is running. Can you tcpdump to see what's different beyond that?

**Comment by wtip** [comment]
tcpdump just the snmp port traffic?

**Comment by brian-brazil** [comment]
Yes

**Comment by wtip** [comment]
While playing around with snmpbulkwalk I may have discovered that simultaneously an application running on a server that is connected to this switch is throwing a network error. The whole reason for me wanting to look at the switch stats in prometheus was to figure out if there is unusually network activity at these times.

I'm going to wait on the tcpdump for now because I've disabled the snmp exporter to see if my network issue goes away.

**Comment by wtip** [comment]
Here is a tcpdump of just port 161 from a machine running the exporter and doing one request to this switch. https://drive.google.com/file/d/0B5i8w4m3C5wyc2ZuNnRGTmNjaXM/view?usp=drivesdk
file is 31KB

**Comment by brian-brazil** [comment]
```
20:40:04.779867 IP 10.2.2.51.38583 > 10.255.255.43.161:  GetBulk(31)  N=0 M=25 .1.3.6.1.2.1.31.1.1.1.14.25
20:40:04.891253 IP 10.255.255.43.161 > 10.2.2.51.38583:  GetResponse(470)  .1.3.6.1.2.1.31.1.1.1.14.26=1 .1.3.6.1.2.1.31.1.1.1.14.27=1 .1.3.6.1.2.1.31.1.1.1.14.28=1 .1.3.6.1.2.1.31.1.1.1.14.29=1 .1.3.6.1.2.1.31.1.1.1.14.30=1 .1.3.6.1.2.1.31.1.1.1.14.31=1 .1.3.6.1.2.1.31.1.1.1.14.32=1 .1.3.6.1.2.1.31.1.1.1.14.100000=2 .1.3.6.1.2.1.31.1.1.1.14.100001=2 .1.3.6.1.2.1.31.1.1.1.15.1=0 .1.3.6.1.2.1.31.1.1.1.15.2=0 .1.3.6.1.2.1.31.1.1.1.15.3=0 .1.3.6.1.2.1.31.1.1.1.15.4=0 .1.3.6.1.2.1.31.1.1.1.15.5=0 .1.3.6.1.2.1.31.1.1.1.15.6=0 .1.3.6.1.2.1.31.1.1.1.15.7=0 .1.3.6.1.2.1.31.1.1.1.15.8=0 .1.3.6.1.2.1.31.1.1.1.15.9=0 .1.3.6.1.2.1.31.1.1.1.15.10=0 .1.3.6.1.2.1.31.1.1.1.15.11=0 .1.3.6.1.2.1.31.1.1.1.15.12=0 .1.3.6.1.2.1.31.1.1.1.15.13=0 .1.3.6.1.2.1.31.1.1.1.15.14=0 .1.3.6.1.2.1.31.1.1.1.15.15=0 .1.3.6.1.2.1.31.1.1.1.15.16=0
20:40:04.891502 IP 10.2.2.51.38583 > 10.255.255.43.161:  GetBulk(31)  N=0 M=25 .1.3.6.1.2.1.31.1.1.1.15.16
20:40:05.004390 IP 10.255.255.43.161 > 10.2.2.51.38583:  GetResponse(479)  .1.3.6.1.2.1.31.1.1.1.15.17=1000 .1.3.6.1.2.1.31.1.1.1.15.18=1000 .1.3.6.1.2.1.31.1.1.1.15.19=1000 .1.3.6.1.2.1.31.1.1.1.15.20=1000 .1.3.6.1.2.1.31.1.1.1.15.21=1000 .1.3.6.1.2.1.31.1.1.1.15.22=1000 .1.3.6.1.2.1.31.1.1.1.15.23=1000 .1.3.6.1.2.1.31.1.1.1.15.24=1000 .1.3.6.1.2.1.31.1.1.1.15.25=1000 .1.3.6.1.2.1.31.1.1.1.15.26=0 .1.3.6.1.2.1.31.1.1.1.15.27=0 .1.3.6.1.2.1.31.1.1.1.15.28=0 .1.3.6.1.2.1.31.1.1.1.15.29=0 .1.3.6.1.2.1.31.1.1.1.15.30=0 .1.3.6.1.2.1.31.1.1.1.15.31=0 .1.3.6.1.2.1.31.1.1.1.15.32=0 .1.3.6.1.2.1.31.1.1.1.15.100000=0 .1.3.6.1.2.1.31.1.1.1.15.100001=0 .1.3.6.1.2.1.31.1.1.1.16.1=1 .1.3.6.1.2.1.31.1.1.1.16.2=1 .1.3.6.1.2.1.31.1.1.1.16.3=1 .1.3.6.1.2.1.31.1.1.1.16.4=1 .1.3.6.1.2.1.31.1.1.1.16.5=1 .1.3.6.1.2.1.31.1.1.1.16.6=1 .1.3.6.1.2.1.31.1.1.1.16.7=1
```

The 0s are what the switch is returning. My guess is that it can't quite handle switching objects inside one GetBulk. I'd suggest playing around with snmpbulkget to verify.

**Comment by wtip** [comment]
I'm really not familar with snmp or the snmpbulkget command so I'm not sure exactly what you meant by playing around with it. I did the following. Not sure if it confirms your theory.

```
root@test:~# snmpbulkget -v 2c -Cr3 -c public 10.255.255.43 .1.3.6.1.2.1.31.1.1.1.15.1
iso.3.6.1.2.1.31.1.1.1.15.2 = Gauge32: 1000
iso.3.6.1.2.1.31.1.1.1.15.3 = Gauge32: 1000
iso.3.6.1.2.1.31.1.1.1.15.4 = Gauge32: 1000
root@test:~# snmpbulkget -v 2c -Cr3 -c public 10.255.255.43 .1.3.6.1.2.1.31.1.1.1.15.0
iso.3.6.1.2.1.31.1.1.1.15.1 = Gauge32: 1000
iso.3.6.1.2.1.31.1.1.1.15.2 = Gauge32: 1000
iso.3.6.1.2.1.31.1.1.1.15.3 = Gauge32: 1000
root@test:~# snmpbulkget -v 2c -Cr4 -c public 10.255.255.43 .1.3.6.1.2.1.31.1.1.1.14.100000
iso.3.6.1.2.1.31.1.1.1.14.100001 = INTEGER: 2
iso.3.6.1.2.1.31.1.1.1.15.1 = Gauge32: 0
iso.3.6.1.2.1.31.1.1.1.15.2 = Gauge32: 0
iso.3.6.1.2.1.31.1.1.1.15.3 = Gauge32: 0
```

**Comment by brian-brazil** [comment]
That's the bug in the switch confirmed, I'd report the above to your vendor.

To workaround, you can specify each OID individually to be walked - though some future performance improvements I have in mind will break that again.
